username,date,retweets,favorites,text,geo,mentions,hashtags,id,permalink
BitcoinViews,2015-02-23 16:59,1,0,"#bitcoin #btc New Post - No, Bitcoin Really Isn't The Solution To Greece's Debt Problems - http:// bit.ly/1LzNZbl",,,#bitcoin #btc,"570010195427852290",https://twitter.com/BitcoinViews/status/570010195427852290
ComSenseNews,2015-02-23 16:59,1,2,"New blog post!! http:// bit.ly/BitcoinBeef Everything you need to know about #bitcoin , the dollar, and what you're really worth. #commonsense",,,#bitcoin #commonsense,"570010049784848384",https://twitter.com/ComSenseNews/status/570010049784848384
bitcoinfirehose,2015-02-23 16:58,2,2,"Issues with Circle. Account in Manual Review http:// ift.tt/1BgPvhe #reddit #bitcoin",,,#reddit #bitcoin,"570009955866152960",https://twitter.com/bitcoinfirehose/status/570009955866152960
CryptoZiggy,2015-02-23 16:58,0,1,"Last: 0.00000023 BTC Market Cap: $8,596.16 USD Hashrate: 119.46 MH/s Diff: 1 Block: 484562 #Hempcoin $ THC #potcoin #bitcoin",,,#Hempcoin #potcoin #bitcoin,"570009932541489152",https://twitter.com/CryptoZiggy/status/570009932541489152
codingcoop,2015-02-23 16:58,0,1,"@AshleyTyCooper having to live on #Bitcoin is a very real struggle. Much more so than, say, "giving up" chocolate or Facebook",,@AshleyTyCooper,#Bitcoin,"570009914778591232",https://twitter.com/codingcoop/status/570009914778591232
bitcoinfirehose,2015-02-23 16:58,0,1,"Free electricity, 125/15 internet, new computer, crypto mining or what? http:// ift.tt/1w4oDti #reddit #bitcoin",,,#reddit #bitcoin,"570009907702980608",https://twitter.com/bitcoinfirehose/status/570009907702980608
diiorioanthony,2015-02-23 16:58,3,2,"Catch @jeffreyatucker this week on Decentral Talk Live @Libertydotme @decentral .tv #bitcoin pic.twitter.com/GibPjc739G",,@jeffreyatucker @Libertydotme @decentral,#bitcoin,"570009902267002880",https://twitter.com/diiorioanthony/status/570009902267002880
BitcoinFeeds,2015-02-23 16:58,1,1,"#Bitcoin #Reddit Follow up to the local bank that told me not to transact with Coinbase @http:// ift.tt/1D4Tjx8",,@http,#Bitcoin #Reddit,"570009860466712576",https://twitter.com/BitcoinFeeds/status/570009860466712576
bitcoinagile,2015-02-23 16:58,1,1,"Bayside Corp. launches Vault 51, #secure offline storage for #bitcoin #bAgile http:// bit.ly/1BgTryA",,,#secure #bitcoin #bAgile,"570009853348974592",https://twitter.com/bitcoinagile/status/570009853348974592
atmbombs,2015-02-23 16:58,0,1,"The best time to buy #bitcoin was 6 years ago. The second best time is now.",,,#bitcoin,"570009823846092800",https://twitter.com/atmbombs/status/570009823846092800