username,date,retweets,favorites,text,geo,mentions,hashtags,id,permalink
bitcoinfirehose,2015-02-27 16:59,2,2,"Half the people looking at this picture see a white mewn, the other half a blue dewn http:// ift.tt/1ACHwsw #reddit #bitcoin",,,#reddit #bitcoin,"571459750942146560",https://twitter.com/bitcoinfirehose/status/571459750942146560
bitcoinfirehose,2015-02-27 16:59,0,0,"Is Andrew Bird an economist? http:// ift.tt/1ACHukm #reddit #bitcoin",,,#reddit #bitcoin,"571459749927129088",https://twitter.com/bitcoinfirehose/status/571459749927129088
bitcoinfirehose,2015-02-27 16:59,0,0,"RobotUnderdog (live action DBZ producers) now accept bitcoin donations directly on their site http:// ift.tt/1BJISV1 #reddit #bitcoin",,,#reddit #bitcoin,"571459746563276800",https://twitter.com/bitcoinfirehose/status/571459746563276800
davesag,2015-02-27 16:59,4,2,"Do you think #bitcoin could become the currency of space? https://www. zapchain.com/a/3hcAlZZIcI",,,#bitcoin,"571459678955175936",https://twitter.com/davesag/status/571459678955175936
bitcoinvalue,2015-02-27 16:59,3,0,"Value of #Bitcoin gaining 6% in last 24 hrs. Value was $236.56. Now at 252.10 USD. http:// bitcoinbnk.com/market/BTC/USD /bitstamp …",,,#Bitcoin,"571459536688709633",https://twitter.com/bitcoinvalue/status/571459536688709633
BitcoinCL,2015-02-27 16:59,2,0,"#btc Join Us > http:// sobit.us Samsung Note 3 Galaxy Sprint CASH ONLY (Midtown)… http:// dlvr.it/8mPDJb #newyork #bitcoins #bitcoin",,,#btc #newyork #bitcoins #bitcoin,"571459532922093568",https://twitter.com/BitcoinCL/status/571459532922093568
Bizness777,2015-02-27 16:58,2,1,"The future of Money http:// bit.ly/1tnX0xO #money #bitcoin #business #entrepreneur #cash #future",,,#money #bitcoin #business #entrepreneur #cash #future,"571459484071038976",https://twitter.com/Bizness777/status/571459484071038976
btc_report,2015-02-27 16:58,0,0,"JP Morgan Goes Hunting for Disruptors and Bitcoin Experts - Wall Street Journal (blog) http:// dlvr.it/8mPJH3 #bitcoin #news",,,#bitcoin #news,"571459282685685760",https://twitter.com/btc_report/status/571459282685685760
CryptoJauregui,2015-02-27 16:58,0,0,"http:// ift.tt/1DjrTna JP Morgan Goes Hunting for Disruptors and Bitcoin Experts - Wall Street Journal (blog) #Bitcoin",,,#Bitcoin,"571459268764958720",https://twitter.com/CryptoJauregui/status/571459268764958720
mshapiro,2015-02-27 16:57,1,1,"JP Morgan Goes Hunting for Disruptors and Bitcoin Experts - Wall Street Journal (blog) http:// bit.ly/1DjrMbc #bitcoin",,,#bitcoin,"571459124124385280",https://twitter.com/mshapiro/status/571459124124385280