username,date,retweets,favorites,text,geo,mentions,hashtags,id,permalink
FuturegrooveNET,2015-06-06 17:59,1,1,"Thanks for the #follow #TFB @ChaChChia ! #Free #Bitcoin @http:// bit.ly/1jyIxVx ! via http:// uapp.ly",,@ChaChChia @http,#follow #TFB #Free #Bitcoin,"607336144846462976",https://twitter.com/FuturegrooveNET/status/607336144846462976
CoinfeedIO,2015-06-06 17:59,0,0,"#Bitcoin in the Headlines: BitLicense Arrives, But Wild West Remains http:// tinyurl.com/p7debdb",,,#Bitcoin,"607335922355589120",https://twitter.com/CoinfeedIO/status/607335922355589120
Yodo7979,2015-06-06 17:58,0,0,"I attacked Robot-lvl 8, and I've earned a total of 768,791 free satoshis! http://www. robotcoingame.com/?id=1NU2KFBB1s wadG3XAqTk2hdR1MVZEUTWHs … #rffobotcoingame #Bitcoin #FreeBitcoin",,,#rffobotcoingame #Bitcoin #FreeBitcoin,"607335777337540608",https://twitter.com/Yodo7979/status/607335777337540608
bitcoinfirehose,2015-06-06 17:58,0,0,"Some crazy guys just launched blockchain technology that will change crypto finance. DigitalNote. http:// ift.tt/1GrXGtN #reddit #bitcoin",,,#reddit #bitcoin,"607335741845340160",https://twitter.com/bitcoinfirehose/status/607335741845340160
bitcoinfirehose,2015-06-06 17:58,3,1,"Typical Saturday night http:// ift.tt/1T3U9oW #reddit #bitcoin",,,#reddit #bitcoin,"607335740616359936",https://twitter.com/bitcoinfirehose/status/607335740616359936
Liybov19,2015-06-06 17:58,0,0,"I just won free 0.00000357 BTC from http://www. satoshicity.org / #bitcoin #satoshi #freebitcoin #faucet с помощью @SatoshiCity",,@SatoshiCity,#bitcoin #satoshi #freebitcoin #faucet,"607335733276352513",https://twitter.com/Liybov19/status/607335733276352513
CoinfeedIO,2015-06-06 17:58,0,0,"Is #Bitcoin Mining Really a Ponzi Scheme? (Op-Ed) http:// tinyurl.com/pg4ufhj pic.twitter.com/PFmMwbEuic",,,#Bitcoin,"607335667639664640",https://twitter.com/CoinfeedIO/status/607335667639664640
BizFuturist,2015-06-06 17:57,0,0,"#Overstock Will Issue a Private Bond Powered by #Bitcoin Tech http:// dlvr.it/B7BGt3 #Wired",,,#Overstock #Bitcoin #Wired,"607335454191386624",https://twitter.com/BizFuturist/status/607335454191386624
ListInEurope,2015-06-06 17:57,0,0,"#Bitcoin Collective Consciousness: Take this idea with a grain of salt. Open your mind to consider its possibi... http:// bit.ly/1QACKjI",,,#Bitcoin,"607335435728068609",https://twitter.com/ListInEurope/status/607335435728068609
Altconomy,2015-06-06 17:57,0,0,"Collective Consciousness: Take this idea with a grain of salt. Open your mind to consider its... http:// bit.ly/1QACKjI #bitcoin #reddit",,,#bitcoin #reddit,"607335433836462080",https://twitter.com/Altconomy/status/607335433836462080