username,date,retweets,favorites,text,geo,mentions,hashtags,id,permalink
Dashpay,2016-02-13 16:59,10,15,"We are excited that #JuanSGalt will be representing Dash in Acapulco ! http:// anarchapulco.com/home/schedule/ #DashDc #darkcoin #cryptocurrency #bitcoin",,,#JuanSGalt #DashDc #darkcoin #cryptocurrency #bitcoin,"698657884637237248",https://twitter.com/Dashpay/status/698657884637237248
FreeBitcoiners,2016-02-13 16:59,0,0,"@giantwebdev Register & Manage ALL YOUR ALTCOIN WALLETS IN ONE PLACE FOR FREE; http:// goo.gl/FSJFQt #altwallet #bitcoin",,@giantwebdev,#altwallet #bitcoin,"698657852877991937",https://twitter.com/FreeBitcoiners/status/698657852877991937
bitcoinfirehose,2016-02-13 16:59,0,0,"What are the most reputable escrows out there? http:// ift.tt/1Wkb1rl #reddit #bitcoin",,,#reddit #bitcoin,"698657759978455040",https://twitter.com/bitcoinfirehose/status/698657759978455040
bitcoinfirehose,2016-02-13 16:59,0,0,"Coinbase WTF Yo http:// ift.tt/1WkaYLZ #reddit #bitcoin",,,#reddit #bitcoin,"698657759068348416",https://twitter.com/bitcoinfirehose/status/698657759068348416
bitcoinfirehose,2016-02-13 16:59,0,0,"Here comes higher prices again, coming month will be crazy. http:// ift.tt/1RAqgwO #reddit #bitcoin",,,#reddit #bitcoin,"698657758128766976",https://twitter.com/bitcoinfirehose/status/698657758128766976
BitcoinAndBets,2016-02-13 16:59,8,6,"#Bitcoin #Betting : Planet Nine to be confirmed before the end of the year https://www. betmoose.com/bet/planet-nin e-to-be-confirmed-before-the-end-of-the-year-1612?ref=scacco … tnx @Bitcoingarden pic.twitter.com/VjdiydXRUJ",,@Bitcoingarden,#Bitcoin #Betting,"698657757151567873",https://twitter.com/BitcoinAndBets/status/698657757151567873
julia_vaingurt,2016-02-13 16:58,0,0,"Bitcoin Revolution Gets on Its Way But Many People Reject the New Version: Bitcoin has split, again. ... http:// cur.lv/vdxez #bitcoin",,,#bitcoin,"698657623550337024",https://twitter.com/julia_vaingurt/status/698657623550337024
News_Bitcoin,2016-02-13 16:58,0,0,"Bitcoin Revolution Gets on Its Way But Many People Reject the New Version: Bitcoin has split, again. ... http:// bit.ly/1ob3Nut #bitcoin",,,#bitcoin,"698657617661419520",https://twitter.com/News_Bitcoin/status/698657617661419520
Luismanzano05,2016-02-13 16:57,0,0,"My robot has 1,447 hp left! I've earned a total of 986,960 free satoshis from http://www. robotcoingame.com/?id=4964491 #robotcoingame #Bitcoin",,,#robotcoingame #Bitcoin,"698657340317372416",https://twitter.com/Luismanzano05/status/698657340317372416
BotFomo,2016-02-13 16:57,0,0,"ALERT: CHINA is FOMO'ing up by 0.57% to 2664.11 CNY in the past 5 minutes #bitcoin",,,#bitcoin,"698657303793418240",https://twitter.com/BotFomo/status/698657303793418240