username,date,retweets,favorites,text,geo,mentions,hashtags,id,permalink
ListInEurope,2016-10-11 17:59,0,1,"#Bitcoin TIL people still leave small notes and tips for Satoshi at the first created BTC address. Eg: 0.0000... http:// bit.ly/2epJHvZ",,,#Bitcoin,"785993289325383680",https://twitter.com/ListInEurope/status/785993289325383680
Altconomy,2016-10-11 17:59,0,0,"TIL people still leave small notes and tips for Satoshi at the first created BTC address. Eg... http:// bit.ly/2epJHvZ #bitcoin #reddit",,,#bitcoin #reddit,"785993287215620096",https://twitter.com/Altconomy/status/785993287215620096
Bitcoin_Latest,2016-10-11 17:59,0,0,"TIL people still leave small notes and tips for Satoshi at the first created BTC address. Eg: 0.0000... http:// cur.lv/131ly9 #bitcoin",,,#bitcoin,"785993286523629568",https://twitter.com/Bitcoin_Latest/status/785993286523629568
Bitcoin_Latest,2016-10-11 17:59,0,0,"I have put together a straight forward, simple language explanation on what Bitcoin is (while avoidi... http:// cur.lv/131ly7 #bitcoin",,,#bitcoin,"785993284812312576",https://twitter.com/Bitcoin_Latest/status/785993284812312576
LuckyBitGame,2016-10-11 17:58,0,0,"Are you searching for low risk but high multipliers? You should try the yellow line on http:// buff.ly/2e5nQWu #bitcoin #gambling",,,#bitcoin #gambling,"785992960664043520",https://twitter.com/LuckyBitGame/status/785992960664043520
hernzzzzzz,2016-10-11 17:58,1,3,"Historic news!! Bigger blocks now pool mines empty block #bitcoin #notshitcoin pic.twitter.com/ifbkeoHr6D",,,#bitcoin #notshitcoin,"785992924559310848",https://twitter.com/hernzzzzzz/status/785992924559310848
userprofile,2016-10-11 17:56,0,0,"Top photo is a Chinese #bitcoin miner. The bottom a 20th century mainframe. #blockchain @BlockchainCAN #trustmachine pic.twitter.com/5V7unu2O92",,@BlockchainCAN,#bitcoin #blockchain #trustmachine,"785992557763432450",https://twitter.com/userprofile/status/785992557763432450
cryptinsight,2016-10-11 17:55,0,0,"ビットコイン県連銘柄～ビットコイン、取得時に消費税課さず 17年春にも　通貨の位置づけ明確に #ビットコイン #Bitcoin #消費税 #通貨 http:// iponet.blog101.fc2.com/blog-entry-175 9.html …",,,# #Bitcoin # #,"785992239105339393",https://twitter.com/cryptinsight/status/785992239105339393
BitcoinForums,2016-10-11 17:54,0,0,"Micro Earnings • Freebitco.in - Best / Longest Lasting Bitcoin Faucet! https:// forum.bitcoin.com/viewtopic.php? t=11519&p=33700#p33700 … #bitcoin",,,#p33700 #bitcoin,"785991959232012288",https://twitter.com/BitcoinForums/status/785991959232012288
bitcoinfirehose,2016-10-11 17:54,0,0,"Is anyone else experiencing delays in bitcoin purchases from circle? http:// ift.tt/2dU4TYe #reddit #bitcoin",,,#reddit #bitcoin,"785991934439526400",https://twitter.com/bitcoinfirehose/status/785991934439526400