username,date,retweets,favorites,text,geo,mentions,hashtags,id,permalink
taniiire_cool,2017-04-03 17:59,0,1,"Bonus Bitcoin. Free bitcoin faucet. Claim up to 5000 satoshi every 15 minutes. http:// bonusbitcoin.co/?ref=14F4BB137 0F0 … #bitcoin #faucet عبر @bonusbit",,@bonusbit,#bitcoin #faucet,"849048691801501703",https://twitter.com/taniiire_cool/status/849048691801501703
bitcoinbase,2017-04-03 17:59,0,0,"Good investing is a peculiar balance between the conviction to follow your ideas and the... Sell/฿uy http:// bit.ly/2mdYD3U #Bitcoin",,,#Bitcoin,"849048633593004032",https://twitter.com/bitcoinbase/status/849048633593004032
AZforex99,2017-04-03 17:58,1,2,"#Bitcoin long term bullish signal. Meanwhile #ETHEREUM is medium term bearish. Musical #cryptocurrency rotation continues #Crypto #trading pic.twitter.com/OzmGqkbGww",,,#Bitcoin #ETHEREUM #cryptocurrency #Crypto #trading,"849048480483991552",https://twitter.com/AZforex99/status/849048480483991552
bitcoinfirehose,2017-04-03 17:57,0,0,"Help Recovering Bitcoin - not sure if this is the right subreddit http:// ift.tt/2ny0wF7 #reddit #bitcoin",,,#reddit #bitcoin,"849048300309405696",https://twitter.com/bitcoinfirehose/status/849048300309405696
bitcoinfirehose,2017-04-03 17:57,0,0,"ELI5: Segwit? http:// ift.tt/2n5q7tM #reddit #bitcoin",,,#reddit #bitcoin,"849048297931243520",https://twitter.com/bitcoinfirehose/status/849048297931243520
bitcoinfirehose,2017-04-03 17:57,0,0,"Bitcoin Exchange Bitfinex Buys Back All Remaining 'Hack Credit' Tokens http:// ift.tt/2nxUqEH #reddit #bitcoin",,,#reddit #bitcoin,"849048296177926144",https://twitter.com/bitcoinfirehose/status/849048296177926144
bitcoinfirehose,2017-04-03 17:57,0,0,"Need Bitcoins fast. http:// ift.tt/2n5JZx0 #reddit #bitcoin",,,#reddit #bitcoin,"849048294370181122",https://twitter.com/bitcoinfirehose/status/849048294370181122
bitcoinfirehose,2017-04-03 17:57,0,0,"Bitcoin Price Weekly Analysis BTC/USD Breaks Higher - NEWSBTC http:// ift.tt/2nxDFtv #reddit #bitcoin",,,#reddit #bitcoin,"849048292637933570",https://twitter.com/bitcoinfirehose/status/849048292637933570
bitcoinfirehose,2017-04-03 17:57,0,0,"Megaupload Back Online: Kim Dotcom Unveils Bitcoin Powered Version of New Sharing Site http:// ift.tt/2n5wWf7 #reddit #bitcoin",,,#reddit #bitcoin,"849048291203579904",https://twitter.com/bitcoinfirehose/status/849048291203579904
bitcoinfirehose,2017-04-03 17:57,0,0,"Bitcoin (BTC/USD) Price Technical Analysis for April 3, 2017 http:// ift.tt/2nxG2wi #reddit #bitcoin",,,#reddit #bitcoin,"849048289756540930",https://twitter.com/bitcoinfirehose/status/849048289756540930