username,date,retweets,favorites,text,geo,mentions,hashtags,id,permalink
dg1kjd,2011-05-02 17:06,0,0,"just began testing #bitcoin , please send me 0.01 for test to 1MVLWZfSDvBYbNFvUcXQqx2zCKroXJ13SB",,,#bitcoin,"65190460175548416",https://twitter.com/dg1kjd/status/65190460175548416
bitcoineconomy,2011-05-02 16:15,3,0,"1 BTC = $3.22 USD, Size: 6.07M BTC, Last 24h: 0.13M BTC in 3.0K trx, Difficulty: 109.7K, Forum posts/day: 1,385, Nodes: 1.8K, #bitcoin",,,#bitcoin,"65177538263130112",https://twitter.com/bitcoineconomy/status/65177538263130112
topnewsbitcoin,2011-05-02 16:13,2,0,"Weekly: http://j.mp/l8RMcG News of the week: PayPal freezes out CoinPal. NameCoin progress, BTC/USD market exchange rate rises. #bitcoin",,,#bitcoin,"65177133118537728",https://twitter.com/topnewsbitcoin/status/65177133118537728
plutec_net,2011-05-02 15:42,0,0,"Todavía no he conseguido generar ni un bloque para #Bitcoin . Probando a 10663 khash/s :(.",,,#Bitcoin,"65169337752883200",https://twitter.com/plutec_net/status/65169337752883200
brocktice,2011-05-02 14:54,0,0,"Finally running #cyanogenmod on my viewsonic g-tab, and it finally feels like a first-class device. Thanks #teamdouche ! Got a #bitcoin addr?",,,#cyanogenmod #teamdouche #bitcoin,"65157290214440960",https://twitter.com/brocktice/status/65157290214440960
ploum,2011-05-02 14:36,1,1,"#bitcoin becomes finally useful : http://bitmunchies.com/",,,#bitcoin,"65152784412053504",https://twitter.com/ploum/status/65152784412053504
Cyanilla,2011-05-02 14:29,0,0,"Reading: Bulgarian Overview of Bitcoin http://www.bitcoin.org/smf/index.php?topic=7065.msg103379#msg103379 #bitcoin via @bitcoininfo",,@bitcoininfo,#msg103379 #bitcoin,"65151036427476992",https://twitter.com/Cyanilla/status/65151036427476992
bitcoinpoet,2011-05-02 14:05,0,0,"3 notes - Bitcoin Money: So long, CoinPal, and thanks for all the bitcoins! After selling more than 600... http://bit.ly/l7tzQ7 #bitcoin",,,#bitcoin,"65144852064645121",https://twitter.com/bitcoinpoet/status/65144852064645121
bitcoinpoet,2011-05-02 14:05,0,0,"Bitcoins Wallet (BitcoinsWallet) on Twitter: Bitcoins Wallet (BitcoinsWallet) is on Twitter. Sign up fo... http://bit.ly/jzwMfF #bitcoin",,,#bitcoin,"65144850219147264",https://twitter.com/bitcoinpoet/status/65144850219147264
bitcoinpoet,2011-05-02 14:05,0,0,"Bitcoin News: Bitcoin News - Monday, Apr 25, 2011: Bitcoin News - Monday, Apr 25, 2011 Monday, Apr 25th... http://bit.ly/lmuwkt #bitcoin",,,#bitcoin,"65144849246076928",https://twitter.com/bitcoinpoet/status/65144849246076928
TheRealPlato,2011-05-02 13:41,3,0,""When will the economy recover? Not till we do somethin about it. #Bitcoin 's a good option, it saves us all a lotta bullshit" #oldppltweets",,,#Bitcoin #oldppltweets,"65138859763179520",https://twitter.com/TheRealPlato/status/65138859763179520
SamirAllioui,2011-05-02 09:53,0,0,"Ok, i just "coined" a word for #Botnet #bitcoin mining. "ZombieMiners" ^_^",,,#Botnet #bitcoin,"65081566468128768",https://twitter.com/SamirAllioui/status/65081566468128768
SamirAllioui,2011-05-02 09:52,0,0,"When do we see the first #botnet that converts CPU and/or GPU Idle time into #Bitcoin #currency ?! What about .gov networks at night ?",,,#botnet #Bitcoin #currency,"65081171289190400",https://twitter.com/SamirAllioui/status/65081171289190400
bgeron,2011-05-02 09:34,0,0,"Zojuist een pianoalbum gekocht met #bitcoin , een veilige, handige online valuta. http://bit.ly/mHGOAW",,,#bitcoin,"65076746202001408",https://twitter.com/bgeron/status/65076746202001408
gamamb,2011-05-02 08:39,0,0,"Namecoin - distributed DNS on top of #Bitcoin infrastructure https://github.com/vinced/namecoin @namecoin",,@namecoin,#Bitcoin,"65062802473226240",https://twitter.com/gamamb/status/65062802473226240
BitcoinBonus,2011-05-02 07:38,0,0,"#CafePress now available for 10% bonuses on #BitcoinBonus , check out the great #bitcoin tee shirts! http://bitcoinbonus.com/cafepress",,,#CafePress #BitcoinBonus #bitcoin,"65047632204148736",https://twitter.com/BitcoinBonus/status/65047632204148736
Gigathink,2011-05-02 07:14,0,0,"@mrboolf: #Bitcoin , la moneta digitale decentralizzata - http://is.gd/jvwugh",,@mrboolf,#Bitcoin,"65041352542535680",https://twitter.com/Gigathink/status/65041352542535680
bitcoinrebate,2011-05-02 07:08,0,0,"#1: Deus Ex: Human Revolution - Augmented Edition (PC DVD): Deus Ex: Human Revolution - Au... http://amzn.to/m0AiyV #bitcoin #rebate #uk",,,#1 #bitcoin #rebate #uk,"65040070297661440",https://twitter.com/bitcoinrebate/status/65040070297661440
bitcoinrebate,2011-05-02 07:08,0,0,"#2: Lego Pirates of the Caribbean (Wii): Lego Pirates of the Caribbean (Wii) by Disney Int... http://amzn.to/k6c9QM #bitcoin #rebate #uk",,,#2 #bitcoin #rebate #uk,"65040069387493377",https://twitter.com/bitcoinrebate/status/65040069387493377
matshenricson,2011-05-02 05:17,0,0,"Som vanligt mycket intressant #bitcoin lunch med @cyberzac Det finns sjukt stora möjligheter här. Troligen inte så många lagar att manövrera",,@cyberzac,#bitcoin,"65012108647075840",https://twitter.com/matshenricson/status/65012108647075840
_viq,2011-05-02 04:55,1,0,"Wow, #bitcoin value skyrocketed recently, I wonder what happened, what caused this.",,,#bitcoin,"65006408374042624",https://twitter.com/_viq/status/65006408374042624
topnewsbitcoin,2011-05-02 04:53,1,0,"Daily: http://j.mp/ivna2P Mt. Gox exchange back online. New IRC channel: #bitcoin -pit. Press, articles & blog posts. Update on Plato's trip.",,,#bitcoin,"65005869510823936",https://twitter.com/topnewsbitcoin/status/65005869510823936
TheBitcoinSun,2011-05-02 04:18,0,0,"The Bitcoin Sun - Looking for Subeditors, like writing or have an interest in media? http://goo.gl/jOo4x #bitcoin",,,#bitcoin,"64997217651523584",https://twitter.com/TheBitcoinSun/status/64997217651523584
bitbid_auctions,2011-05-02 03:12,0,0,"BitBid.net is launching soon. Like eBay for #bitcoin only it doesn't suck.",,,#bitcoin,"64980573273329664",https://twitter.com/bitbid_auctions/status/64980573273329664
flix1,2011-05-02 02:23,1,0,"#bitcoin bitcoins are now >3$ http://bitcoincharts.com/charts/mtgoxUSD The best experiment in P2P currency.",,,#bitcoin,"64968120523161600",https://twitter.com/flix1/status/64968120523161600
midmagic,2011-05-01 22:24,0,0,"฿ hits $4.15 briefly; MtGox is DDoS'd. And so the greed sets in. Hysteria follows. Enhance thy calm, people! #bitcoin",,,#bitcoin,"64908057712410624",https://twitter.com/midmagic/status/64908057712410624
TheRealPlato,2011-05-01 18:13,0,0,"@dgcmagazine #WaPo wrong on #bitcoin - this is better: http://techland.time.com/2011/04/16/online-cash-bitcoin-could-challenge-governments/",,@dgcmagazine,#WaPo #bitcoin,"64844933986656256",https://twitter.com/TheRealPlato/status/64844933986656256